Date,Title,Categories,Lyrics,Tag
Apr 1,Vaana vaana song lyrics – Daddy(2001),Telugu Lyrics,"Vaana vaana song lyrics<BR><BR><BR>vanaa vanaa tenela vanaa<BR>vanaa vanaa vennela vanaa<BR>kuravani kuravani ne niluvunaa karaganii<BR>papa kanti chupulalo pala panti navvulalo<BR>bala megha malikalo jaluvaru tholakarilo<BR>thadisi thadisiponii madi murisi murisiponii<BR>thadisi thadisiponii mudi bigisi bigisiponii<BR>chiru chiru palukula chinukulalo<BR>bira bira parugula varadalalo<BR>thadisi thadisiponii madi murisi murisiponii<BR>vana vana vennela vanaa ||*2*||mungitlo mabbe vache manasulona merupoche<BR>panneti chinuke vache pranamlona chiguroche<BR>bulli bujji vana devathoche<BR>gunde paina neellu challi lala pose nede<BR>ghallu ghallu gali devathoche<BR>jeevithaana prema jalli lali paata paade<BR>ohooo…sravanala rani vache<BR>vunna cheeku chintha cheekatlannii kadigi<BR>inkaa inkaa yem kavalo adige<BR>madhuramga kadhe sagutunte<BR>mana benga ilaa karugutunte<BR>veganga kale teerutunte<BR>aa ganga ilaku jarutunte<BR>thadisi thadisiponii madi murisi murisiponii ||*vanaa vanaa*||chinnathanam mundarikoche peddarikam marupoche<BR>yetigattu yeduruga vache isuka gullu guruthoche<BR>karu mabbu neeru chindutunte<BR>kagithala padavalenno kanti mundukoche<BR>neetilona ataladutunte ammanoti teepi thitlu jnyapakanikoche<BR>ohoo…paita konge godugu kagaa<BR>ee chotu chotu chotuu yentho yentho iruku<BR>yemaindante neku naku yeruke<BR>okkatigaa ila pakkanuntu iddaramai sadaa sardukuntu<BR>mugguridii oke pranamantu muddulatho kadhe rasukuntu<BR>thadisi thadisiponii madi murisi murisiponii ||*vanaa vanaa*||<BR><BR><BR><BR>movie:daddy(2001)<BR>music director:s a rajkumar<BR>star cast:chiranjeevi,simran<BR>singer(s):chithra,udit narayan","Vaana vaana song lyrics,ChandraBose song lyrics,Chiranjeevi movie lyrics,Daddy movie lyrics,S A Raj kumar music lyrics,Vaana Vaana song lyrics,daddy(2001),s a rajkumar,chiranjeevi,simran,chithraudit narayan"
Mar 31,Guudu chadiri song lyrics – Rajanna(2012),Telugu Lyrics,"Guudu chadiri song lyrics<BR><BR><BR>gudu chadiri koyila kunna datey konda konna…<BR>thodu needa inka paina galli enda vannaa..<BR>e kunna elagaina tana gamyam cheranna<BR>tana kalla phalinchena vidhi etundo painaa….<BR>a gaganam lo ashale harivillai veresenaa..aaa…gizi gadu levakane chiru chinni charanalu maziline vadilenu lee..<BR>kamalalu eliyakane kasikondu padalu raadari pattenulee…<BR>gaarala mallamma chere aurentha duranna undoo papammm…mmm..<BR>nuvvaina cheppanna aa uriki rajjanna okkadenee unddadanii<BR>kadili eduruga rammani chinnari mallamma ki kastha cheruvu kammaniii..edurenda sudi gali jadi vaana emina a nadaka aageedi leeduuu..<BR>a chinni kallallo velige asha jyothi e galiki aaripoduu<BR>chikku darrulonna rekka ranni konna dikkuledinna papamm..mmm<BR>nuvvaina cheppana devuditho rajanna kastha karuninchalannii..<BR>pagalanaka reeyanaka preminchee papani kanta kanipettalanii..<BR>oo kanta kanipettalanii kanta kanipettalanii<BR>oo kanta kanipettalanii….<BR><BR><BR><BR>movie:rajanna(2012)<BR>music director:mm keeravani<BR>star cast:nagarjuna,sneha<BR>singer(s):mettapalli surender,chaithra","Guudu chadiri song lyrics,Guudu chadiri song lyrics,K Siva datta song lyrics,MM Keeravani music lyrics,Nagarjuna movie lyrics,Rajanna movie lyrics,rajanna(2012),mm keeravani,nagarjuna,sneha,mettapalli surenderchaithra"
Mar 31,GIjigaadu song lyrics – Rajanna(2012),Telugu Lyrics,"GIjigaadu song lyrics<BR><BR><BR>gijigaadu tana goodu vadili rakunadu sooridu raledani<BR>kolani lo kamalaalu thala dhinchukunnayi poddu podavaledanigijigaadu tana goodu vadili rakunadu sooridu raledani<BR>kolani lo kamalaalu thala dhinchukunnayi poddu podavaledanigaarala mallama kalle tervaakundhi thelavaralede ani<BR>nuvvanna chepanna sooridiki rajanna yendakke lelemani<BR>kondekki tana yedu gurrala bandekki pandakki rarammani<BR>bathukamma pandakki rarammani bathukamma pandakki rarammani.*nadiminta sooridu nippulu cherigeydu pasikandhu padukundhani<BR>nadiminta sooridu nippulu cherigeydu pasikandhu padukundhani<BR>nuvvaina chepanna sooridiki rajanna mobbu chaatuki pommani<BR>na bidda ki ravvvantha neediimmani<BR>kantiki reppale kaachukunna kaani nee vaipe naa thalli choopu<BR>nuvvana cheppana mallama ki rajannaa<BR>ilu dhaati povvodhani dhayachesi nee dariki ravaddani<BR>ilu dhaati povvodhani dhayachesi nee dariki ravaddani<BR><BR><BR><BR>movie:rajanna(2012)<BR>music director:mm keeravani<BR>star cast:nagarjuna,sneha<BR>singer(s):sanjeev chimmalgi,kaala bhairava","GIjigaadu song lyrics,GIjigadu song lyrics,K Shiva datta song lyrics,MM Keeravani music lyrics,Nagarjuna movie lyrics,Rajanna movie lyrics,rajanna(2012),mm keeravani,nagarjuna,sneha,sanjeev chimmalgikaala bhairava"
Mar 31,Amma avani song lyrics – Rajanna(2012),Telugu Lyrics,"Amma avani song lyrics<BR><BR><BR>amaaa…aaa..aaa…avani..<BR>amma avani nelathalli ani<BR>enni saarlu pilichinaa thanivitheeradendukaniamma avani nelathalli ani<BR>enni saarlu pilichinaa thanivitheeradendukaniamma avani nelathalli ani<BR>enni saarlu pilichinaa thanivitheeradendukani<BR>kanipenchina vodilone kannu muyani<BR>malli ee gudilone kallu theravaniamma avani nelathalli ani<BR>enni saarlu pilichinaa thanivitheeradendukanithalli ninu thaakithene thanuvu piulakaristhundi<BR>nee yadapai vaalithene menu paravashisthundi<BR>theta telugu jaana koti rathanaala veena<BR>nee padamulana nuvi naaku swargam kanna minna<BR>amma avani nelathalli ani<BR>enni saarlu pilichinaa thanivitheeradendukani<BR>amma avani…nee biddala sourya dhairya saahasa gaadhalu vinte<BR>naranaraalalo raktham pongi poraluthundi<BR>rigaga rigaga riga rigaga rigaga riga<BR>rigaga rigaga riga riga risa dapa dasa<BR>rigagaa ripapapa gadadada padadada<BR>sada sada paga paga sada sada sada sada<BR>pada sada pada sada pada sada pada sada<BR>sasa sasa sasa sasa riri<BR>sasa sasa sasa sasa gaga<BR>riga risa riga risa .. riga risa riga risa<BR>sari sari ga risa ga risa ga risa<BR>riga riga pa .. gari sada pa<BR>gapa pada dasa sari gari sada<BR>pada dasa sari riga maga risa<BR>ri ga maa risa dapa dasa riga pa<BR>sari gapa dasa riga paa…<BR>dapa gari sari sada.. veera maatha vamma<BR>rana dheera charithavamma<BR>punya bhumivamma .. nuvu dhanya charithavamma<BR>thalli koraku chese aa thyaagamenthadaina<BR>dehamaina praanamaina konchame kadamma<BR>adi minchina naadannadi neeki galadedamma*amma avani nelathalli ani<BR>enni saarlu pilichinaa thanivitheeradendukani<BR>amma avani…….<BR><BR><BR><BR>movie:rajanna(2012)<BR>music director:mm keeravani<BR>star cast:nagarjuna,sneha<BR>singer(s):malavika","Amma avani song lyrics,Amma avani song lyrics,K Siva datta song lyrics,MM Keeravani music lyrics,Nagarjuna movie lyrics,Rajanna movie lyrics,rajanna(2012),mm keeravani,nagarjuna,sneha,malavika"
Mar 30,Pavuraniki Panjaraniki song lyrics – Chanti(1992),Telugu Lyrics,"Pavuraniki Panjaraniki song lyrics<BR><BR><BR>paavuraniki panjaraniki pelli chese paadu lokam<BR>kalaratrikee chandamavakee mullu pette moodalokam<BR>paavuraniki panjaraniki pelli chese paadu lokam<BR>kalaratrikee chandamavakee mullu pette moodalokam<BR>kodigattina deepaale gudi haratulayyena<BR>o…o…o….o…paavuraniki panjaraniki pelli chese paadu lokam<BR>kalaratrikee chandamavakee mullu pette moodalokamtaanichhu paalalo premanta kalipi<BR>chakindi na kanna talli<BR>laalinchu paatalo neetnta telipi<BR>penchindi naalona manchi<BR>kapatalu mosaalu naalona levu<BR>kalanaina apakari kanu<BR>chesina papamula ivi a vidhi shapamula<BR>maarani jaatakama idi devuni shasanama<BR>idi teerede kada…paavuraniki panjaraniki pelli chese paadu lokam<BR>kalaratrikee chandamavakee mullu pette moodalokam<BR>kodigattina deepaale gudi haratulayyena<BR>o…o…o….o…paavuraniki panjaraniki pelli chese paadu lokam<BR>kalaratrikee chandamavakee mullu pette moodalokamtalnte taadane talichanu naadu<BR>adi yedo telisenu nedu<BR>a tali pellike rujuvanna nijamu<BR>taruvatha telisemi phalamu<BR>emaina edaina jarigindi ghoram<BR>naameeda nakele kopam<BR>naatone vedamula idi teerani vedanala<BR>naamadi lopamula ivi arani shokamula<BR>ika ee badhae poda…paavuraniki panjaraniki pelli chese paadu lokam<BR>kalaratrikee chandamavakee mullu pette moodalokam<BR>kodigattina deepaale gudi haratulayyena<BR>o…o…o….o…paavuraniki panjaraniki pelli chese paadu lokamkalaratrikee chandamavakee mullu pette moodalokam<BR><BR><BR><BR>movie:chanti(1992)<BR>music director:ilayaraja<BR>star cast:venkatesh,meena<BR>singer(s):s p balu","Pavuraniki Panjaraniki song lyrics,Chanti movie lyrics,Ilayaraja Music Lyrics,Pavuraniki panjaraniki song lyrics,Venkatesh movie lyrics,Veturi Song lyrics,chanti(1992),ilayaraja,venkatesh,meena,s p balu"
Mar 30,O prema Song (male) lyrics – chanti(1992),Telugu Lyrics,"O prema Song (male) lyrics<BR><BR><BR>o prema na prema preme naku daivam neeve naku pranam<BR>o prema na prema na paate vinarava<BR>preme naku daivam neeve naku pranam<BR>vinipinchenu na ganam rappinchenu nee pranam<BR>o prema na prema na paate vinaravagadichina dinamula kathalanu maruvaku manasulo priyatama<BR>shilanoka manishiga malachina cheliyaku maraname sharanama<BR>pranayapu pilupulu pralayapu biguvulu telusuko priyatama<BR>vidhikika vilayamu yedalaku vijayamu geluchuko hrudayamaa<BR>nenu kaane dooram ee prema kade neram<BR>sagipote dooram ika agipoda kaalam<BR>gudilo devi lekunte kodigattenu ee deepamo prema na prema preme naku daivam neeve naku pranam<BR>o prema na prema na paate vinarava<BR>preme naku daivam neeve naku pranam<BR>vinipinchenu na ganam rappinchenu nee pranamo prema na prema na paate vinarava<BR><BR><BR><BR>movie:chanti(1992)<BR>music director:ilayaraja<BR>star cast:venkatesh,meena<BR>singer(s):s p balu","O prema Song (male) lyrics,Chanti movie lyrics,Ilayaraja Music Lyrics,O prema male song lyrics,Venkatesh movie lyrics,Veturi Song lyrics,chanti(1992),ilayaraja,venkatesh,meena,s p balu"
Mar 30,O prema song (female) lyrics – Chanti(1992),Telugu Lyrics,"O prema song (female) lyrics<BR><BR><BR>o prema na prema..<BR>daivaalaade juudam..<BR>dayyam paade veedam..<BR>o prema na prema premiste chaavena..<BR>daivaalaade juudam..<BR>dayyam paade veedam..<BR>raktam loni sudi gundam<BR>raayaipoye anubhandam \\o prema\\kshanamoka yugamuga gadipina bratukidi<BR>telusuko priyatama..<BR>virahame sukhamani kalayika kalayani<BR>kalachute madhurama..<BR>mrutulaku chitulaku mugiyani kathalivi<BR>kadali ra pranayama..<BR>adugulu chilikina rudirapu madugula<BR>yerupule pralayama..<BR>jaaripoye kaalam..chejaaripoye yogam..<BR>ragulutunna gaayam..nenadagalenu nyayam..karuvavutaanu kannullo..gurutuntaanu guundello.. \\o prema\\<BR><BR><BR><BR>movie:chanti(1992)<BR>music director:ilayaraja<BR>star cast:venkatesh,meena<BR>singer(s):chitra","O prema song (female) lyrics,Chanti movie lyrics,Ilayaraja Music Lyrics,O prema female song lyrics,Venkatesh movie lyrics,Veturi Song lyrics,chanti(1992),ilayaraja,venkatesh,meena,chitra"
Mar 30,Jabiliki Vennelaki song (female) lyrics – Chanti(1992),Telugu Lyrics,"Jabiliki Vennelaki song (female) lyrics<BR><BR><BR>jabiliki vennelakee puttina punnamile<BR>gangalo tenelalo kadigina mutyamule<BR>muddulone poddhupoye<BR>kanti nindaa niddarove chanti pade jolalone<BR>jaabiliki vennelakee puttina punnamile<BR>gangalo tenelalo kadigina mutyamulevemanayya na guruve velimudra na chadauve<BR>paalabuvva na paluke hayi nidra papalake<BR>vemanayya na guruve velimudra na chadauve<BR>paalabuvva na paluke hayi nidra papalake<BR>koonalamma na padame tenekanna tiyyanide<BR>konalannee padukune guvva chinna pata ide<BR>ragamula talamulo nakasale ravule<BR>padukonu jnanamune nakosage daivame<BR>muddulone poddhupoye<BR>kanti nindaa niddarove chnti pade jolalone<BR>jaabiliki vennelakee puttina punnamilegangalo tenelalo kadigina mutyamule<BR><BR><BR><BR>movie:chanti(1992)<BR>music director:ilayaraja<BR>star cast:venkatesh,meena<BR>singer(s):chitra","Jabiliki Vennelaki song (female) lyrics,Chanti movie lyrics,Ilayaraja Music Lyrics,Jabiliki vennelaki song female lyrics,Sahithi song lyrics,Venkatesh movie lyrics,chanti(1992),ilayaraja,venkatesh,meena,chitra"
Mar 30,Jabiliki Vennelaki Song lyrics(male) – Chanti(1992),Telugu Lyrics,"Jabiliki Vennelaki Song lyrics(male)<BR><BR><BR>jabiliki vennelaki puttina punnami le..<BR>gangalalo thenelalo kadigina muthyamu le..<BR>muddhulone poddhupoye….<BR>kanti ninda nidharove….chanti paade jolalone..<BR>jabiliki vennelaki puttina punnami le..<BR>ganjalalo tenelalo kadigina muthyamu le..kanna thalli prema kanna annamedhi paapalaki..<BR>amma muddhu kanna vere muddhaledhu aakaliki..<BR>kanna thalli prema kanna annamedhi paapalaki<BR>amma muddhu kanna vere muddhaledhu aakaliki<BR>devathanti amma neede kovele biddalaki..<BR>chemmagillu bidda kanne edupe ammalaki..<BR>amma chethi kammanaina dhebba kuda dheevena..<BR>buvva petti bujjaginche laalanentho theeyana..<BR>manchukanna challanaina…. malle kanna thellanaina…<BR>amma paate paadukona…..<BR>malle kanna thellanaina amma paate paadukona..<BR><BR><BR><BR>movie:chanti(1992)<BR>music director:ilayaraja<BR>star cast:venkatesh,meena<BR>singer(s):s p balu","Jabiliki Vennelaki Song lyrics(male),Chanti movie lyrics,Ilayaraja Music Lyrics,Jabiliki vennelaki song male lyrics,Sahithi song lyrics,Venkatesh movie lyrics,chanti(1992),ilayaraja,venkatesh,meena,s p balu"
Mar 30,Idi Tailam petti talam patti song lyrics – Chanti(1992),Telugu Lyrics,"Idi Tailam petti talam patti song lyrics<BR><BR><BR>idi tailam petti talam patti talanguto talantite motha<BR>idi olle ruddi budde shuddhi chese koddi tamashale teeta<BR>o namaha shivayaha ontlo vede mayam<BR>tama kaasto koosto ayyindante hayenandi gaayam<BR>o namaha shivayaha ontlo vede mayam<BR>tama kaasto koosto ayyindante hayenandi gaayam<BR>idi tailam petti talam patti talanguto talantite mothanavvistoo nadipistha panipaatlu<BR>mimmu kavvistoo vinipistha na paatlu<BR>mamatala marajulule ee annalu<BR>pasi manasunna mallikale a chellelu<BR>penchanandi kanda a kandallone gundae<BR>meere naku anda meeranta challamgunda<BR>aha yeganaina maganaaina yento konta undaalandi<BR>undi manasundiidi tailam petti talam patti talanguto talantite motha<BR>idi olle ruddi budde shuddhi chese koddi tamashale teeta<BR>o namaha shivayaha ontlo vede mayam<BR>tama kaasto koosto ayyindante hayenandi gaayam<BR>idi tailam petti talam patti talanguto talantite mothagulloki poledu neneppudu<BR>amma ollone unnadu na devudu<BR>balloki poledu chinnappudu<BR>palle pathale nerchadu ee bheemudu<BR>nee paadaalante chotae ne paaga vese kota<BR>chellista mee mata ne vallista mee pata<BR>palukakulalo puttanandi kokilaga maranandi<BR>kaaka idi kukuidi tailam petti talam patti talanguto talantite motha<BR>idi olle ruddi budde shuddhi chese koddi tamashale teeta<BR>o namaha shivayaha ontlo vede mayam<BR>tama kaasto koosto ayyindante hayenandi gaayam<BR>o namaha shivayaha ontlo vede mayam<BR>tama kaasto koosto ayyindante hayenandi gaayamidi tailam petti talam patti talanguto talantite motha<BR><BR><BR><BR>movie:chanti(1992)<BR>music director:ilayaraja<BR>star cast:venkatesh,meena<BR>singer(s):s.p.balu","Idi Tailam petti talam patti song lyrics,Chanti movie lyrics,Idi tailam patti talam petti song lyrics,Ilayaraja Music Lyrics,Venkatesh movie lyrics,Veturi Song lyrics,chanti(1992),ilayaraja,venkatesh,meena,s.p.balu"
Mar 30,Ennenno andaalu song lyrics – Chanti(1992),Telugu Lyrics,"Ennenno andaalu song lyrics<BR><BR><BR>ennenno andaaluyevevo raagalu<BR>vese poola baanam poose gaali gandham<BR>podde leni aakaasam haddeleni aanandam ||*yennenno*||siri gala chilakalu ila digi nadachuta nyayama dharmama<BR>tolakari merupulu chilikina chinukulu ningilo aaguna<BR>chalimara gadulalo sukhapadu batukulu vesavee koruna<BR>alikina gudisela chaluvala manasulu medalo dorukuna<BR>andaala medallone antadu kaaliki mannu<BR>bangaaru pantalu pande mannuku chaaladu minnu<BR>nirupedillu podarillu ilalo unna harivillu ||*yennenno*||jala jala padamula alajadi nadulaku vantanee paadana<BR>mila mila merisina tala tala taaralu ningine veeduna<BR>cheruvula kadupuna virisina taamara teenele puuyuna<BR>minuguru purugula midi midi velugulu vennelai kaayuna<BR>yegaali medallonu deepam la ney unna<BR>ma palle singaaraalu neelo nene kanna<BR>goodaaramma paravallu telugintamma tirunallu ||*yennenno*||<BR><BR><BR><BR>movie:chanti(1992)<BR>music director:ilayaraja<BR>star cast:venkatesh,meena<BR>singer(s):s p balu,chitra","Ennenno andaalu song lyrics,Chanti movie lyrics,Ennenno andaalu song lyrics,Ilayaraja Music Lyrics,Venkatesh movie lyrics,Veturi Song lyrics,chanti(1992),ilayaraja,venkatesh,meena,s p balu,chitra"
Mar 30,Annula minnala ammadi kannula song lyrics – Chnati(1992),Telugu Lyrics,"Annula minnala ammadi kannula song lyrics<BR><BR><BR>annula minnala ammadi kannulu gummadi puvvulule<BR>toli siggula moggala buggalau kamdhina puttadi andamule<BR>suma sundari andelalo chirumuvvala sandadule<BR>shubhamangala velallo shubhamastula deevenale<BR>alivene ee rani…annula minnala ammadi kannulu gummadi puvvulule<BR>toli siggula moggala buggalau kamdhina puttadi andamulea devudu a devito alaka boonenemo<BR>ee roopuga sreedevini ilaku panpenemo<BR>mohanala soyagaala menako<BR>mari devaloka paarijaata maaliko<BR>rekulu vichhina sirimalli annala muddula chelli<BR>nelaku vachhina jaabilli vannela rangula valli<BR>viraboose poobonee…annula minnala ammadi kannulu gummadi puvvulule<BR>toli siggula moggala buggalau kamdhina puttadi andamule<BR>suma sundari andelalo chirumuvvala sandadule<BR>shubhamangala velallo shubhamastula deevenale<BR>alivene ee rani…annula minnala ammadi kannulu gummadi puvvulule<BR>toli siggula moggala buggalau kamdhina puttadi andamulea kaluvalu ee kanulaku maaru roopulemo<BR>a nagavalu vekuvalaku melukolupulemo<BR>paala kadali meeda telu chandriko<BR>gaganaala vela kantuleenu tarako<BR>vennalle vastadu onadu rajunti goppinti mogudu<BR>ooranta sandellu aanadu vaadamta viyyala varu<BR>pippi pee..pee..dum..dum..dum…..annula minnala ammadi kannulu gummadi puvvulule<BR>toli siggula moggala buggalau kamdhina puttadi andamule<BR>suma sundari andelalo chirumuvvala sandadule<BR>shubhamangala velallo shubhamastula deevenale<BR>alivene ee rani…annula minnala ammadi kannulu gummadi puvvululetoli siggula moggala buggalau kamdhina puttadi andamule<BR><BR><BR><BR>movie:chanti(1992)<BR>music director:ilayaraja<BR>star cast:venkatesh,meena<BR>singer(s):s.p.balu","Annula minnala ammadi kannula song lyrics,Annula minnala ammadi kannula song lyrics,Chanti movie lyrics,Ilayaaja music lyrics,Venkatesh movie lyrics,Veturi Song lyrics,chanti(1992),ilayaraja,venkatesh,meena,s.p.balu"
